{
  "capsules": {
    "evidence-vs-demo": {
      "caseId": "evidence-vs-demo",
      "difficulty": "intro",
      "competencyIds": [
        "c-capstone-pipeline"
      ],
      "bank": [
        {
          "key": "base",
          "prompt": "Abschluss der Capstone: Die Demo und die Retrospektive sind fertig und sehen stark aus. Was belegen sie in dieser Plattform?",
          "correct": "Work Evidence: Sie dokumentieren Arbeit und Grenzen — Mastery entsteht nur aus den deterministisch geprüften Teiltests.",
          "wrong": [
            "Mastery-Nachweis: Eine überzeugende Demo ersetzt die Teiltests, weil sie das Ergebnis live zeigt.",
            "Gar nichts — Demo und Retrospektive zählen in keiner Form und können übersprungen werden.",
            "Sie ersetzen die Abnahme der Verträge, wenn die Präsentation alle Phasen zeigt."
          ],
          "solution": "Demo und Retrospektive sind Work Evidence: Sie dokumentieren geleistete Arbeit und Grenzen, aber Mastery entsteht ausschließlich aus den deterministisch geprüften Teiltests (mindestens zwei unabhängige Treffer, zwei Definitionen, 14 Tage Abstand, keine disqualifizierte Instanz). Genau deshalb meldet der Projekt-Report integrity: self-reported. Konzeptfrage: zählt als Bearbeitungsnachweis, nicht als Mastery-Nachweis."
        },
        {
          "key": "teiltests-mastery",
          "prompt": "Was belegt Mastery auf dieser Plattform?",
          "correct": "Nur die deterministisch geprüften Teiltests — mindestens zwei unabhängige Treffer in zwei Definitionen mit 14 Tagen Abstand und ohne disqualifizierte Instanz.",
          "wrong": [
            "Eine live gezeigte Demo des Endergebnisses.",
            "Eine ausführliche Retrospektive mit benannten Lektionen.",
            "Ein vollständiges README, das alle Phasen beschreibt."
          ],
          "solution": "Mastery ist an die Evidenzregeln der Teiltests gebunden: zwei unabhängige Treffer, zwei Definitionen, zeitlicher Abstand, keine disqualifizierte Instanz. Demo, Retrospektive und README sind Work Evidence — sie dokumentieren, beweisen aber nichts."
        },
        {
          "key": "runner-report-integrity",
          "prompt": "Der Projekt-Report meldet integrity: self-reported. Was heißt das?",
          "correct": "Die Report-Werte sind selbstberichtete Arbeitsevidenz — geprüft wird über die Verträge (Tests, Manifest, Reproduktion), nicht über den Report.",
          "wrong": [
            "Der Report ist ein Zertifikat der Plattform über die Pipeline-Qualität.",
            "Die Werte wurden maschinell von der Plattform verifiziert.",
            "self-reported bedeutet ohne Aussagekraft — der Report wird ignoriert."
          ],
          "solution": "self-reported ist eine ehrliche Statusmarke: Der Report dokumentiert, was gelaufen ist, aber die Autorität liegt bei den deterministischen Verträgen. Wer den Report liest, sieht Evidenz über Arbeit — keine Abnahme."
        },
        {
          "key": "demo-video",
          "prompt": "Ein Team zeigt ein poliertes Demo-Video der laufenden Pipeline statt bestandener Teiltests. Was zählt dieses Video?",
          "correct": "Work Evidence — es dokumentiert geleistete Arbeit, aber Mastery entsteht nur aus den geprüften Teiltests.",
          "wrong": [
            "Mastery — das Video beweist das Ergebnis direkt.",
            "Nichts — Videos sind als Artefakt unzulässig.",
            "Vertragsabnahme — das Video ersetzt das Manifest."
          ],
          "solution": "Ein Video zeigt einen Lauf, nicht wiederholbare Evidenz: Es ist Work Evidence, kein Testnachweis. Mastery verlangt deterministisch geprüfte Teiltests; die Abnahme läuft über die Verträge."
        },
        {
          "key": "manifest-rolle",
          "prompt": "Welche Rolle spielt das Manifest mit den sha256-Hashes in der Abnahme?",
          "correct": "Es ist der prüfbare Vertrag: Die Freeze-Prüfung gleicht die gelieferten Dateien gegen die fixierten Hashes.",
          "wrong": [
            "Es ist eine formlose Dokumentation ohne Prüfwirkung.",
            "Es ersetzt die Teiltests, weil es den Stand fixiert.",
            "Es beweist Mastery der Person, die es erstellt hat."
          ],
          "solution": "Das Manifest bindet Dateinamen an Hashes — damit ist der Prüfstand maschinell nachrechenbar. Es ist Teil der Vertragsabnahme (Work-Evidence-Seite der Pipeline), kein Mastery-Nachweis und kein Testersatz."
        },
        {
          "key": "retro-zweck",
          "prompt": "Wozu dient die Retrospektive im Capstone?",
          "correct": "Als Work Evidence: Sie dokumentiert Prozess, Grenzen und offene Risiken ehrlich — sie ist kein Testnachweis.",
          "wrong": [
            "Als Ersatz für fehlende Teiltests, wenn sie gut begründet.",
            "Als Mastery-Nachweis über die gelernten Konzepte.",
            "Als Pflichtformat, das inhaltlich leer bleiben darf."
          ],
          "solution": "Die Retrospektive macht sichtbar, was funktioniert hat und was nicht — ehrliche Grenzdokumentation statt geschöntem Abschluss. Das ist wertvolle Arbeitsevidenz, aber sie prüft nichts und ersetzt nichts."
        },
        {
          "key": "arbeitsevidenz-wert",
          "prompt": "Ist Work Evidence ohne die geprüften Teiltests wertlos?",
          "correct": "Nein — sie dokumentiert ehrlich, was gebaut wurde und wo die Grenzen liegen; nur als Mastery-Beweis taugt sie nicht.",
          "wrong": [
            "Ja — ungeprüfte Dokumentation ist generell wertlos.",
            "Nein — sie ersetzt die Teiltests vollständig.",
            "Ja — nur das Manifest zählt als Artefakt."
          ],
          "solution": "Work Evidence hat eigenen Wert: Sie macht Arbeit und Grenzen nachvollziehbar. Der Fehler liegt in beiden Extremen — sie als wertlos abtun oder sie zum Mastery-Beweis aufblasen."
        },
        {
          "key": "kein-mastery-ohne-tests",
          "prompt": "Ein Projekt hat Demo, Retrospektive und sauberes README, aber keine bestandenen Teiltests. Was ist der Befund?",
          "correct": "Bearbeitung mit Work Evidence — aber kein Mastery-Nachweis, weil die geprüften Teiltests fehlen.",
          "wrong": [
            "Mastery durch Präsentation, weil alle Artefakte da sind.",
            "Abgenommen, weil Demo und README den Vertrag ersetzen.",
            "Disqualifiziert, weil das Demo-Video fehlt."
          ],
          "solution": "Die Artefakte zeigen Bearbeitung — Work Evidence. Mastery ist ein separater, härterer Nachweis über die Teiltests. Beides auseinanderzuhalten ist der Kern der Plattform-Ehrlichkeit."
        },
        {
          "key": "overclaim-gegenprobe",
          "prompt": "Welche Aussage über den eigenen Runner-Report ist ehrlich?",
          "correct": "„Der Report ist selbstberichtete Arbeitsevidenz und kein Zertifikat.“",
          "wrong": [
            "„Der Runner zertifiziert die Pipeline für den Echteinsatz.“",
            "„Die Demo beweist Mastery über die Teiltests hinaus.“",
            "„Bei überzeugender Demo sind die Teiltests optional.“"
          ],
          "solution": "Die ehrliche Aussage benennt den Status des Reports genau: self-reported, keine Abnahme. Die anderen Optionen behaupten eine Prüfmacht, die Demo oder Report nicht haben — klassische Overclaims."
        },
        {
          "key": "zwei-definitionen",
          "prompt": "Warum verlangt Mastery zwei unabhängige Definitionen und 14 Tage Abstand zwischen den Treffern?",
          "correct": "Damit der Nachweis stabil und reproduzierbar ist — ein einmaliger Treffer in einer Definition zählt nicht als Beherrschen.",
          "wrong": [
            "Damit die Plattform insgesamt mehr Bearbeitungszeit verlangt.",
            "Damit die Demo zweimal gezeigt werden muss.",
            "Damit die Retrospektive zweimal geschrieben wird."
          ],
          "solution": "Die Mastery-Regeln (zwei unabhängige Treffer, zwei Definitionen, 14 Tage Abstand, keine disqualifizierte Instanz) schützen vor Zufallstreffern und Kurzzeit-Effekten. Sie sind der einzige Weg zum Mastery-Status — bewusst anspruchsvoller als Work Evidence."
        },
        {
          "key": "abnahme-vertraege",
          "prompt": "Worüber läuft die Abnahme des Capstone-Projekts?",
          "correct": "Über die Verträge: deterministische Tests, Manifest-Freeze und reproduzierbare Status — Demo und Retrospektive ergänzen als Work Evidence.",
          "wrong": [
            "Über die Demo-Qualität in der Abschlusspräsentation.",
            "Über die Länge und Tiefe der Retrospektive.",
            "Über den Runner-Report als alleiniges Abnahmedokument."
          ],
          "solution": "Abnahme ist Vertragssache: Tests laufen deterministisch, das Manifest fixiert den Prüfstand per Hash, der Status ist reproduzierbar. Demo und Retro dokumentieren den Weg — sie sind Evidenz über Arbeit, nicht die Abnahme selbst."
        },
        {
          "key": "mastery-nicht-selbst",
          "prompt": "Kann ein Team sich Mastery über einen überzeugend geschriebenen Report selbst ausstellen?",
          "correct": "Nein — der Report bleibt self-reported; Mastery entsteht nur aus den geprüften Teiltest-Instanzen.",
          "wrong": [
            "Ja — mit ausführlicher Begründung und sauberen Tabellen.",
            "Ja — wenn die Demo alle Phasen live zeigt.",
            "Nein — Work Evidence ist auf dieser Plattform verboten."
          ],
          "solution": "Selbstberichtete Werte sind ehrlich gemeint, aber nicht autoritativ: integrity: self-reported markiert genau das. Mastery ist kein Dokumentationsprodukt — es fällt ausschließlich aus den deterministisch geprüften Teiltests."
        }
      ]
    },
    "demo-vs-evidence": {
      "caseId": "demo-vs-evidence",
      "difficulty": "intro",
      "competencyIds": [
        "c-capstone-pipeline",
        "c-ml-repro"
      ],
      "bank": [
        {
          "key": "base",